{
  "schemaVersion": "9",
  "verifiedAt": "2026-07-15T00:00:00Z",
  "hashIntegrity": {
    "passed": true,
    "mismatches": [],
    "missingFiles": []
  },
  "referenceIntegrity": {
    "passed": true,
    "danglingReferences": []
  },
  "stateConsistency": {
    "passed": true,
    "inconsistencies": []
  }
}
